
================================================================================
PLANNING SESSION: 7f177c2b
Timestamp: 2026-01-13T07:36:29.173
================================================================================

[INPUT]
  Total motion steps:    3
  MoveJ steps:           1
  MoveL steps:           2
  Gripper operations:    1
  IK solutions/step:     [32]
  Total IK combinations: 32

[MOVEJ IK DETAILS]
  Step 0 (robot2):
    Total IK found:       32
    Collision-free IK:    32

[CONFIG]
  Max Pilz combinations: 16
  Max OMPL combinations: 1024
  Pilz PTP timeout:      10.00 s
  OMPL timeout:          3.00 s
  OMPL planner:          RRTConnect

[PLANNING PHASES]
  Phase 1: Pilz-PTP
    Attempts:         1 / 16
    Duration:         154.33 ms
    Result:           SUCCESS

[PLANNING RESULT]
  Status:          SUCCESS
  Success planner: Pilz-PTP
  Success attempt: 1
  Success IK idx:  [0]
  Total duration:  266.83 ms

[ATTEMPT HISTORY] (1 attempts)
  Format: #attempt [phase] IK=[indices] -> result
  ---------------------------------------------------------------
  #  1 [Pilz-PTP] IK=[0] -> SUCCESS

[EXECUTION]
  Trajectories:    3
  Duration:        7319.44 ms
  Status:          SUCCESS

[SUMMARY]
  2026-01-13T07:36:29.173 | PLAN_OK | EXEC_OK | Steps:3 | IK:32 | Pilz-PTP@1 | Plan:266.83ms | Exec:7319.44ms
================================================================================


================================================================================
PLANNING SESSION: 6c483a41
Timestamp: 2026-01-13T07:36:36.775
================================================================================

[INPUT]
  Total motion steps:    1
  MoveJ steps:           1
  MoveL steps:           0
  Gripper operations:    0
  IK solutions/step:     [32]
  Total IK combinations: 32

[MOVEJ IK DETAILS]
  Step 0 (robot2):
    Total IK found:       32
    Collision-free IK:    32

[CONFIG]
  Max Pilz combinations: 16
  Max OMPL combinations: 1024
  Pilz PTP timeout:      10.00 s
  OMPL timeout:          3.00 s
  OMPL planner:          RRTConnect

[PLANNING PHASES]
  Phase 1: Pilz-PTP
    Attempts:         2 / 16
    Duration:         168.66 ms
    Result:           SUCCESS
    [Backtracking]
      Smart backtracks:   1
      Standard advances:  0
      Stage failures:     {step0:1}
      MoveJ IK changes:   {step0:1}

[PLANNING RESULT]
  Status:          SUCCESS
  Success planner: Pilz-PTP
  Success attempt: 2
  Success IK idx:  [1]
  Total duration:  207.46 ms

[BACKTRACK HISTORY] (last 1 events)
  #1 smart_backtrack: MoveL@0 failed -> changed MoveJ@0 IK 0->1

[ATTEMPT HISTORY] (2 attempts)
  Format: #attempt [phase] IK=[indices] -> result
  ---------------------------------------------------------------
  #  1 [Pilz-PTP] IK=[0] -> FAILED: MoveJ at step 0 (move_j_0) - Stage 'move_j_0' failed to find solution
  #  2 [Pilz-PTP] IK=[1] -> SUCCESS

[EXECUTION]
  Trajectories:    1
  Duration:        4587.49 ms
  Status:          SUCCESS

[SUMMARY]
  2026-01-13T07:36:36.775 | PLAN_OK | EXEC_OK | Steps:1 | IK:32 | Pilz-PTP@2 | BT:1/0 | Plan:207.46ms | Exec:4587.49ms
================================================================================


================================================================================
PLANNING SESSION: 026d1814
Timestamp: 2026-01-13T07:36:41.800
================================================================================

[INPUT]
  Total motion steps:    1
  MoveJ steps:           1
  MoveL steps:           0
  Gripper operations:    0
  IK solutions/step:     [32]
  Total IK combinations: 32

[MOVEJ IK DETAILS]
  Step 0 (robot2):
    Total IK found:       32
    Collision-free IK:    32

[CONFIG]
  Max Pilz combinations: 16
  Max OMPL combinations: 1024
  Pilz PTP timeout:      10.00 s
  OMPL timeout:          3.00 s
  OMPL planner:          RRTConnect

[PLANNING PHASES]
  Phase 1: Pilz-PTP
    Attempts:         1 / 16
    Duration:         129.21 ms
    Result:           SUCCESS

[PLANNING RESULT]
  Status:          SUCCESS
  Success planner: Pilz-PTP
  Success attempt: 1
  Success IK idx:  [0]
  Total duration:  169.55 ms

[ATTEMPT HISTORY] (1 attempts)
  Format: #attempt [phase] IK=[indices] -> result
  ---------------------------------------------------------------
  #  1 [Pilz-PTP] IK=[0] -> SUCCESS

[EXECUTION]
  Trajectories:    1
  Duration:        3791.77 ms
  Status:          SUCCESS

[SUMMARY]
  2026-01-13T07:36:41.800 | PLAN_OK | EXEC_OK | Steps:1 | IK:32 | Pilz-PTP@1 | Plan:169.55ms | Exec:3791.77ms
================================================================================


================================================================================
PLANNING SESSION: de4a8a23
Timestamp: 2026-01-13T07:36:46.004
================================================================================

[INPUT]
  Total motion steps:    1
  MoveJ steps:           1
  MoveL steps:           0
  Gripper operations:    0
  IK solutions/step:     [32]
  Total IK combinations: 32

[MOVEJ IK DETAILS]
  Step 0 (robot2):
    Total IK found:       32
    Collision-free IK:    32

[CONFIG]
  Max Pilz combinations: 16
  Max OMPL combinations: 1024
  Pilz PTP timeout:      10.00 s
  OMPL timeout:          3.00 s
  OMPL planner:          RRTConnect

[PLANNING PHASES]
  Phase 1: Pilz-PTP
    Attempts:         1 / 16
    Duration:         132.63 ms
    Result:           SUCCESS

[PLANNING RESULT]
  Status:          SUCCESS
  Success planner: Pilz-PTP
  Success attempt: 1
  Success IK idx:  [0]
  Total duration:  169.94 ms

[ATTEMPT HISTORY] (1 attempts)
  Format: #attempt [phase] IK=[indices] -> result
  ---------------------------------------------------------------
  #  1 [Pilz-PTP] IK=[0] -> SUCCESS

[EXECUTION]
  Trajectories:    1
  Duration:        2137.26 ms
  Status:          SUCCESS

[SUMMARY]
  2026-01-13T07:36:46.004 | PLAN_OK | EXEC_OK | Steps:1 | IK:32 | Pilz-PTP@1 | Plan:169.94ms | Exec:2137.26ms
================================================================================


================================================================================
PLANNING SESSION: b0152776
Timestamp: 2026-01-13T07:36:48.541
================================================================================

[INPUT]
  Total motion steps:    6
  MoveJ steps:           2
  MoveL steps:           4
  Gripper operations:    2
  IK solutions/step:     [32, 32]
  Total IK combinations: 1024

[MOVEJ IK DETAILS]
  Step 0 (robot1):
    Total IK found:       32
    Collision-free IK:    32
  Step 1 (robot2):
    Total IK found:       32
    Collision-free IK:    32

[CONFIG]
  Max Pilz combinations: 16
  Max OMPL combinations: 1024
  Pilz PTP timeout:      10.00 s
  OMPL timeout:          3.00 s
  OMPL planner:          RRTConnect

[PLANNING PHASES]
  Phase 1: Pilz-PTP
    Attempts:         1 / 16
    Duration:         158.79 ms
    Result:           SUCCESS

[PLANNING RESULT]
  Status:          SUCCESS
  Success planner: Pilz-PTP
  Success attempt: 1
  Success IK idx:  [0, 0]
  Total duration:  1642.01 ms

[ATTEMPT HISTORY] (1 attempts)
  Format: #attempt [phase] IK=[indices] -> result
  ---------------------------------------------------------------
  #  1 [Pilz-PTP] IK=[0,0] -> SUCCESS

[EXECUTION]
  Trajectories:    6
  Duration:        18455.90 ms
  Status:          SUCCESS

[SUMMARY]
  2026-01-13T07:36:48.541 | PLAN_OK | EXEC_OK | Steps:6 | IK:1024 | Pilz-PTP@1 | Plan:1642.01ms | Exec:18455.90ms
================================================================================


================================================================================
PLANNING SESSION: fd2504a2
Timestamp: 2026-01-13T07:37:08.651
================================================================================

[INPUT]
  Total motion steps:    1
  MoveJ steps:           1
  MoveL steps:           0
  Gripper operations:    0
  IK solutions/step:     [32]
  Total IK combinations: 32

[MOVEJ IK DETAILS]
  Step 0 (robot1):
    Total IK found:       32
    Collision-free IK:    32

[CONFIG]
  Max Pilz combinations: 16
  Max OMPL combinations: 1024
  Pilz PTP timeout:      10.00 s
  OMPL timeout:          3.00 s
  OMPL planner:          RRTConnect

[PLANNING PHASES]
  Phase 1: Pilz-PTP
    Attempts:         1 / 16
    Duration:         130.20 ms
    Result:           SUCCESS

[PLANNING RESULT]
  Status:          SUCCESS
  Success planner: Pilz-PTP
  Success attempt: 1
  Success IK idx:  [0]
  Total duration:  168.42 ms

[ATTEMPT HISTORY] (1 attempts)
  Format: #attempt [phase] IK=[indices] -> result
  ---------------------------------------------------------------
  #  1 [Pilz-PTP] IK=[0] -> SUCCESS

[EXECUTION]
  Trajectories:    1
  Duration:        3490.47 ms
  Status:          SUCCESS

[SUMMARY]
  2026-01-13T07:37:08.651 | PLAN_OK | EXEC_OK | Steps:1 | IK:32 | Pilz-PTP@1 | Plan:168.42ms | Exec:3490.47ms
================================================================================


================================================================================
PLANNING SESSION: 2226fbd2
Timestamp: 2026-01-13T07:37:12.552
================================================================================

[INPUT]
  Total motion steps:    1
  MoveJ steps:           1
  MoveL steps:           0
  Gripper operations:    0
  IK solutions/step:     [32]
  Total IK combinations: 32

[MOVEJ IK DETAILS]
  Step 0 (robot1):
    Total IK found:       32
    Collision-free IK:    32

[CONFIG]
  Max Pilz combinations: 16
  Max OMPL combinations: 1024
  Pilz PTP timeout:      10.00 s
  OMPL timeout:          3.00 s
  OMPL planner:          RRTConnect

[PLANNING PHASES]
  Phase 1: Pilz-PTP
    Attempts:         1 / 16
    Duration:         131.92 ms
    Result:           SUCCESS

[PLANNING RESULT]
  Status:          SUCCESS
  Success planner: Pilz-PTP
  Success attempt: 1
  Success IK idx:  [0]
  Total duration:  169.27 ms

[ATTEMPT HISTORY] (1 attempts)
  Format: #attempt [phase] IK=[indices] -> result
  ---------------------------------------------------------------
  #  1 [Pilz-PTP] IK=[0] -> SUCCESS

[EXECUTION]
  Trajectories:    1
  Duration:        4938.28 ms
  Status:          SUCCESS

[SUMMARY]
  2026-01-13T07:37:12.552 | PLAN_OK | EXEC_OK | Steps:1 | IK:32 | Pilz-PTP@1 | Plan:169.27ms | Exec:4938.28ms
================================================================================


================================================================================
PLANNING SESSION: 1d203645
Timestamp: 2026-01-13T07:37:17.889
================================================================================

[INPUT]
  Total motion steps:    1
  MoveJ steps:           1
  MoveL steps:           0
  Gripper operations:    0
  IK solutions/step:     [32]
  Total IK combinations: 32

[MOVEJ IK DETAILS]
  Step 0 (robot1):
    Total IK found:       32
    Collision-free IK:    32

[CONFIG]
  Max Pilz combinations: 16
  Max OMPL combinations: 1024
  Pilz PTP timeout:      10.00 s
  OMPL timeout:          3.00 s
  OMPL planner:          RRTConnect

[PLANNING PHASES]
  Phase 1: Pilz-PTP
    Attempts:         1 / 16
    Duration:         131.17 ms
    Result:           SUCCESS

[PLANNING RESULT]
  Status:          SUCCESS
  Success planner: Pilz-PTP
  Success attempt: 1
  Success IK idx:  [0]
  Total duration:  169.63 ms

[ATTEMPT HISTORY] (1 attempts)
  Format: #attempt [phase] IK=[indices] -> result
  ---------------------------------------------------------------
  #  1 [Pilz-PTP] IK=[0] -> SUCCESS

[EXECUTION]
  Trajectories:    1
  Duration:        3791.84 ms
  Status:          SUCCESS

[SUMMARY]
  2026-01-13T07:37:17.889 | PLAN_OK | EXEC_OK | Steps:1 | IK:32 | Pilz-PTP@1 | Plan:169.63ms | Exec:3791.84ms
================================================================================


================================================================================
PLANNING SESSION: f2972868
Timestamp: 2026-01-13T07:37:22.130
================================================================================

[INPUT]
  Total motion steps:    5
  MoveJ steps:           2
  MoveL steps:           3
  Gripper operations:    2
  IK solutions/step:     [32, 32]
  Total IK combinations: 1024

[MOVEJ IK DETAILS]
  Step 0 (robot1):
    Total IK found:       32
    Collision-free IK:    32
  Step 1 (robot2):
    Total IK found:       32
    Collision-free IK:    32

[CONFIG]
  Max Pilz combinations: 16
  Max OMPL combinations: 1024
  Pilz PTP timeout:      10.00 s
  OMPL timeout:          3.00 s
  OMPL planner:          RRTConnect

[PLANNING PHASES]
  Phase 1: Pilz-PTP
    Attempts:         3 / 16
    Duration:         213.59 ms
    Result:           SUCCESS
    [Backtracking]
      Smart backtracks:   2
      Standard advances:  0
      Stage failures:     {step0:2}
      MoveJ IK changes:   {step0:2}

[PLANNING RESULT]
  Status:          SUCCESS
  Success planner: Pilz-PTP
  Success attempt: 3
  Success IK idx:  [2, 0]
  Total duration:  1380.56 ms

[BACKTRACK HISTORY] (last 2 events)
  #1 smart_backtrack: MoveL@0 failed -> changed MoveJ@0 IK 0->1
  #2 smart_backtrack: MoveL@0 failed -> changed MoveJ@0 IK 1->2

[ATTEMPT HISTORY] (3 attempts)
  Format: #attempt [phase] IK=[indices] -> result
  ---------------------------------------------------------------
  #  1 [Pilz-PTP] IK=[0,0] -> FAILED: MoveJ at step 0 (move_j_0) - Stage 'move_j_0' failed to find solution
  #  2 [Pilz-PTP] IK=[1,0] -> FAILED: MoveJ at step 0 (move_j_0) - Stage 'move_j_0' failed to find solution
  #  3 [Pilz-PTP] IK=[2,0] -> SUCCESS

[EXECUTION]
  Trajectories:    5
  Duration:        17948.96 ms
  Status:          SUCCESS

[SUMMARY]
  2026-01-13T07:37:22.130 | PLAN_OK | EXEC_OK | Steps:5 | IK:1024 | Pilz-PTP@3 | BT:2/0 | Plan:1380.56ms | Exec:17948.96ms
================================================================================


================================================================================
PLANNING SESSION: b37f07d9
Timestamp: 2026-01-13T07:37:41.472
================================================================================

[INPUT]
  Total motion steps:    6
  MoveJ steps:           2
  MoveL steps:           4
  Gripper operations:    2
  IK solutions/step:     [32, 32]
  Total IK combinations: 1024

[MOVEJ IK DETAILS]
  Step 0 (robot2):
    Total IK found:       32
    Collision-free IK:    32
  Step 1 (robot1):
    Total IK found:       32
    Collision-free IK:    32

[CONFIG]
  Max Pilz combinations: 16
  Max OMPL combinations: 1024
  Pilz PTP timeout:      10.00 s
  OMPL timeout:          3.00 s
  OMPL planner:          RRTConnect

[PLANNING PHASES]
  Phase 1: Pilz-PTP
    Attempts:         1 / 16
    Duration:         162.33 ms
    Result:           SUCCESS

[PLANNING RESULT]
  Status:          SUCCESS
  Success planner: Pilz-PTP
  Success attempt: 1
  Success IK idx:  [0, 0]
  Total duration:  1570.03 ms

[ATTEMPT HISTORY] (1 attempts)
  Format: #attempt [phase] IK=[indices] -> result
  ---------------------------------------------------------------
  #  1 [Pilz-PTP] IK=[0,0] -> SUCCESS

[EXECUTION]
  Trajectories:    6
  Duration:        17146.88 ms
  Status:          SUCCESS

[SUMMARY]
  2026-01-13T07:37:41.472 | PLAN_OK | EXEC_OK | Steps:6 | IK:1024 | Pilz-PTP@1 | Plan:1570.03ms | Exec:17146.88ms
================================================================================


================================================================================
PLANNING SESSION: c2ee44bb
Timestamp: 2026-01-13T07:38:00.203
================================================================================

[INPUT]
  Total motion steps:    5
  MoveJ steps:           2
  MoveL steps:           3
  Gripper operations:    2
  IK solutions/step:     [32, 32]
  Total IK combinations: 1024

[MOVEJ IK DETAILS]
  Step 0 (robot2):
    Total IK found:       32
    Collision-free IK:    32
  Step 1 (robot1):
    Total IK found:       32
    Collision-free IK:    32

[CONFIG]
  Max Pilz combinations: 16
  Max OMPL combinations: 1024
  Pilz PTP timeout:      10.00 s
  OMPL timeout:          3.00 s
  OMPL planner:          RRTConnect

[PLANNING PHASES]
  Phase 1: Pilz-PTP
    Attempts:         1 / 16
    Duration:         154.88 ms
    Result:           SUCCESS

[PLANNING RESULT]
  Status:          SUCCESS
  Success planner: Pilz-PTP
  Success attempt: 1
  Success IK idx:  [0, 0]
  Total duration:  1407.38 ms

[ATTEMPT HISTORY] (1 attempts)
  Format: #attempt [phase] IK=[indices] -> result
  ---------------------------------------------------------------
  #  1 [Pilz-PTP] IK=[0,0] -> SUCCESS

[EXECUTION]
  Trajectories:    5
  Duration:        15299.02 ms
  Status:          SUCCESS

[SUMMARY]
  2026-01-13T07:38:00.203 | PLAN_OK | EXEC_OK | Steps:5 | IK:1024 | Pilz-PTP@1 | Plan:1407.38ms | Exec:15299.02ms
================================================================================


================================================================================
PLANNING SESSION: f07670b8
Timestamp: 2026-01-13T07:38:16.922
================================================================================

[INPUT]
  Total motion steps:    6
  MoveJ steps:           2
  MoveL steps:           4
  Gripper operations:    2
  IK solutions/step:     [32, 32]
  Total IK combinations: 1024

[MOVEJ IK DETAILS]
  Step 0 (robot1):
    Total IK found:       32
    Collision-free IK:    32
  Step 1 (robot2):
    Total IK found:       32
    Collision-free IK:    32

[CONFIG]
  Max Pilz combinations: 16
  Max OMPL combinations: 1024
  Pilz PTP timeout:      10.00 s
  OMPL timeout:          3.00 s
  OMPL planner:          RRTConnect

[PLANNING PHASES]
  Phase 1: Pilz-PTP
    Attempts:         1 / 16
    Duration:         158.80 ms
    Result:           SUCCESS

[PLANNING RESULT]
  Status:          SUCCESS
  Success planner: Pilz-PTP
  Success attempt: 1
  Success IK idx:  [0, 0]
  Total duration:  1599.54 ms

[ATTEMPT HISTORY] (1 attempts)
  Format: #attempt [phase] IK=[indices] -> result
  ---------------------------------------------------------------
  #  1 [Pilz-PTP] IK=[0,0] -> SUCCESS

[EXECUTION]
  Trajectories:    6
  Duration:        16598.91 ms
  Status:          SUCCESS

[SUMMARY]
  2026-01-13T07:38:16.922 | PLAN_OK | EXEC_OK | Steps:6 | IK:1024 | Pilz-PTP@1 | Plan:1599.54ms | Exec:16598.91ms
================================================================================


================================================================================
PLANNING SESSION: 9715d20f
Timestamp: 2026-01-13T07:38:35.131
================================================================================

[INPUT]
  Total motion steps:    5
  MoveJ steps:           2
  MoveL steps:           3
  Gripper operations:    2
  IK solutions/step:     [32, 32]
  Total IK combinations: 1024

[MOVEJ IK DETAILS]
  Step 0 (robot1):
    Total IK found:       32
    Collision-free IK:    32
  Step 1 (robot2):
    Total IK found:       32
    Collision-free IK:    32

[CONFIG]
  Max Pilz combinations: 16
  Max OMPL combinations: 1024
  Pilz PTP timeout:      10.00 s
  OMPL timeout:          3.00 s
  OMPL planner:          RRTConnect

[PLANNING PHASES]
  Phase 1: Pilz-PTP
    Attempts:         1 / 16
    Duration:         150.49 ms
    Result:           SUCCESS

[PLANNING RESULT]
  Status:          SUCCESS
  Success planner: Pilz-PTP
  Success attempt: 1
  Success IK idx:  [0, 0]
  Total duration:  1252.86 ms

[ATTEMPT HISTORY] (1 attempts)
  Format: #attempt [phase] IK=[indices] -> result
  ---------------------------------------------------------------
  #  1 [Pilz-PTP] IK=[0,0] -> SUCCESS

[EXECUTION]
  Trajectories:    5
  Duration:        13146.28 ms
  Status:          SUCCESS

[SUMMARY]
  2026-01-13T07:38:35.131 | PLAN_OK | EXEC_OK | Steps:5 | IK:1024 | Pilz-PTP@1 | Plan:1252.86ms | Exec:13146.28ms
================================================================================


================================================================================
PLANNING SESSION: 11fcf944
Timestamp: 2026-01-13T07:38:49.542
================================================================================

[INPUT]
  Total motion steps:    5
  MoveJ steps:           2
  MoveL steps:           3
  Gripper operations:    2
  IK solutions/step:     [32, 32]
  Total IK combinations: 1024

[MOVEJ IK DETAILS]
  Step 0 (robot1):
    Total IK found:       32
    Collision-free IK:    32
  Step 1 (robot2):
    Total IK found:       32
    Collision-free IK:    32

[CONFIG]
  Max Pilz combinations: 16
  Max OMPL combinations: 1024
  Pilz PTP timeout:      10.00 s
  OMPL timeout:          3.00 s
  OMPL planner:          RRTConnect

[PLANNING PHASES]
  Phase 1: Pilz-PTP
    Attempts:         1 / 16
    Duration:         158.41 ms
    Result:           SUCCESS

[PLANNING RESULT]
  Status:          SUCCESS
  Success planner: Pilz-PTP
  Success attempt: 1
  Success IK idx:  [0, 0]
  Total duration:  1335.23 ms

[ATTEMPT HISTORY] (1 attempts)
  Format: #attempt [phase] IK=[indices] -> result
  ---------------------------------------------------------------
  #  1 [Pilz-PTP] IK=[0,0] -> SUCCESS

[EXECUTION]
  Trajectories:    5
  Duration:        15242.36 ms
  Status:          SUCCESS

[SUMMARY]
  2026-01-13T07:38:49.542 | PLAN_OK | EXEC_OK | Steps:5 | IK:1024 | Pilz-PTP@1 | Plan:1335.23ms | Exec:15242.36ms
================================================================================


================================================================================
PLANNING SESSION: eb9731b4
Timestamp: 2026-01-13T07:39:06.133
================================================================================

[INPUT]
  Total motion steps:    6
  MoveJ steps:           2
  MoveL steps:           4
  Gripper operations:    2
  IK solutions/step:     [32, 32]
  Total IK combinations: 1024

[MOVEJ IK DETAILS]
  Step 0 (robot2):
    Total IK found:       32
    Collision-free IK:    32
  Step 1 (robot1):
    Total IK found:       32
    Collision-free IK:    32

[CONFIG]
  Max Pilz combinations: 16
  Max OMPL combinations: 1024
  Pilz PTP timeout:      10.00 s
  OMPL timeout:          3.00 s
  OMPL planner:          RRTConnect

[PLANNING PHASES]
  Phase 1: Pilz-PTP
    Attempts:         1 / 16
    Duration:         160.66 ms
    Result:           SUCCESS

[PLANNING RESULT]
  Status:          SUCCESS
  Success planner: Pilz-PTP
  Success attempt: 1
  Success IK idx:  [0, 0]
  Total duration:  1634.39 ms

[ATTEMPT HISTORY] (1 attempts)
  Format: #attempt [phase] IK=[indices] -> result
  ---------------------------------------------------------------
  #  1 [Pilz-PTP] IK=[0,0] -> SUCCESS

[EXECUTION]
  Trajectories:    6
  Duration:        17642.77 ms
  Status:          SUCCESS

[SUMMARY]
  2026-01-13T07:39:06.133 | PLAN_OK | EXEC_OK | Steps:6 | IK:1024 | Pilz-PTP@1 | Plan:1634.39ms | Exec:17642.77ms
================================================================================


================================================================================
PLANNING SESSION: f521e27c
Timestamp: 2026-01-13T07:39:25.421
================================================================================

[INPUT]
  Total motion steps:    5
  MoveJ steps:           2
  MoveL steps:           3
  Gripper operations:    2
  IK solutions/step:     [32, 32]
  Total IK combinations: 1024

[MOVEJ IK DETAILS]
  Step 0 (robot2):
    Total IK found:       32
    Collision-free IK:    32
  Step 1 (robot1):
    Total IK found:       32
    Collision-free IK:    32

[CONFIG]
  Max Pilz combinations: 16
  Max OMPL combinations: 1024
  Pilz PTP timeout:      10.00 s
  OMPL timeout:          3.00 s
  OMPL planner:          RRTConnect

[PLANNING PHASES]
  Phase 1: Pilz-PTP
    Attempts:         1 / 16
    Duration:         164.00 ms
    Result:           SUCCESS

[PLANNING RESULT]
  Status:          SUCCESS
  Success planner: Pilz-PTP
  Success attempt: 1
  Success IK idx:  [0, 0]
  Total duration:  1521.32 ms

[ATTEMPT HISTORY] (1 attempts)
  Format: #attempt [phase] IK=[indices] -> result
  ---------------------------------------------------------------
  #  1 [Pilz-PTP] IK=[0,0] -> SUCCESS

[EXECUTION]
  Trajectories:    5
  Duration:        16698.17 ms
  Status:          SUCCESS

[SUMMARY]
  2026-01-13T07:39:25.421 | PLAN_OK | EXEC_OK | Steps:5 | IK:1024 | Pilz-PTP@1 | Plan:1521.32ms | Exec:16698.17ms
================================================================================


================================================================================
PLANNING SESSION: 61faf8b1
Timestamp: 2026-01-13T07:39:43.654
================================================================================

[INPUT]
  Total motion steps:    6
  MoveJ steps:           2
  MoveL steps:           4
  Gripper operations:    2
  IK solutions/step:     [32, 32]
  Total IK combinations: 1024

[MOVEJ IK DETAILS]
  Step 0 (robot1):
    Total IK found:       32
    Collision-free IK:    32
  Step 1 (robot2):
    Total IK found:       32
    Collision-free IK:    32

[CONFIG]
  Max Pilz combinations: 16
  Max OMPL combinations: 1024
  Pilz PTP timeout:      10.00 s
  OMPL timeout:          3.00 s
  OMPL planner:          RRTConnect

[PLANNING PHASES]
  Phase 1: Pilz-PTP
    Attempts:         1 / 16
    Duration:         160.79 ms
    Result:           SUCCESS

[PLANNING RESULT]
  Status:          SUCCESS
  Success planner: Pilz-PTP
  Success attempt: 1
  Success IK idx:  [0, 0]
  Total duration:  1675.91 ms

[ATTEMPT HISTORY] (1 attempts)
  Format: #attempt [phase] IK=[indices] -> result
  ---------------------------------------------------------------
  #  1 [Pilz-PTP] IK=[0,0] -> SUCCESS

[EXECUTION]
  Trajectories:    6
  Duration:        18399.32 ms
  Status:          SUCCESS

[SUMMARY]
  2026-01-13T07:39:43.654 | PLAN_OK | EXEC_OK | Steps:6 | IK:1024 | Pilz-PTP@1 | Plan:1675.91ms | Exec:18399.32ms
================================================================================


================================================================================
PLANNING SESSION: f3cb3eed
Timestamp: 2026-01-13T07:40:03.742
================================================================================

[INPUT]
  Total motion steps:    5
  MoveJ steps:           2
  MoveL steps:           3
  Gripper operations:    2
  IK solutions/step:     [32, 32]
  Total IK combinations: 1024

[MOVEJ IK DETAILS]
  Step 0 (robot1):
    Total IK found:       32
    Collision-free IK:    32
  Step 1 (robot2):
    Total IK found:       32
    Collision-free IK:    32

[CONFIG]
  Max Pilz combinations: 16
  Max OMPL combinations: 1024
  Pilz PTP timeout:      10.00 s
  OMPL timeout:          3.00 s
  OMPL planner:          RRTConnect

[PLANNING PHASES]
  Phase 1: Pilz-PTP
    Attempts:         4 / 16
    Duration:         278.71 ms
    Result:           SUCCESS
    [Backtracking]
      Smart backtracks:   3
      Standard advances:  0
      Stage failures:     {step0:1, step3:2}
      MoveJ IK changes:   {step0:1, step1:2}

[PLANNING RESULT]
  Status:          SUCCESS
  Success planner: Pilz-PTP
  Success attempt: 4
  Success IK idx:  [1, 2]
  Total duration:  1402.99 ms

[BACKTRACK HISTORY] (last 3 events)
  #1 smart_backtrack: MoveL@0 failed -> changed MoveJ@0 IK 0->1
  #2 smart_backtrack: MoveL@3 failed -> changed MoveJ@1 IK 0->1
  #3 smart_backtrack: MoveL@3 failed -> changed MoveJ@1 IK 1->2

[ATTEMPT HISTORY] (4 attempts)
  Format: #attempt [phase] IK=[indices] -> result
  ---------------------------------------------------------------
  #  1 [Pilz-PTP] IK=[0,0] -> FAILED: MoveJ at step 0 (move_j_0) - Stage 'move_j_0' failed to find solution
  #  2 [Pilz-PTP] IK=[1,0] -> FAILED: MoveL at step 3 (move_l_3) - Stage 'move_l_3' failed to find solution
  #  3 [Pilz-PTP] IK=[1,1] -> FAILED: MoveL at step 3 (move_l_3) - Stage 'move_l_3' failed to find solution
  #  4 [Pilz-PTP] IK=[1,2] -> SUCCESS

[EXECUTION]
  Trajectories:    5
  Duration:        23254.68 ms
  Status:          SUCCESS

[SUMMARY]
  2026-01-13T07:40:03.742 | PLAN_OK | EXEC_OK | Steps:5 | IK:1024 | Pilz-PTP@4 | BT:3/0 | Plan:1402.99ms | Exec:23254.68ms
================================================================================


================================================================================
PLANNING SESSION: 6884d0d3
Timestamp: 2026-01-13T07:40:28.417
================================================================================

[INPUT]
  Total motion steps:    6
  MoveJ steps:           2
  MoveL steps:           4
  Gripper operations:    2
  IK solutions/step:     [32, 32]
  Total IK combinations: 1024

[MOVEJ IK DETAILS]
  Step 0 (robot2):
    Total IK found:       32
    Collision-free IK:    32
  Step 1 (robot1):
    Total IK found:       32
    Collision-free IK:    32

[CONFIG]
  Max Pilz combinations: 16
  Max OMPL combinations: 1024
  Pilz PTP timeout:      10.00 s
  OMPL timeout:          3.00 s
  OMPL planner:          RRTConnect

[PLANNING PHASES]
  Phase 1: Pilz-PTP
    Attempts:         3 / 16
    Duration:         237.28 ms
    Result:           SUCCESS
    [Backtracking]
      Smart backtracks:   2
      Standard advances:  0
      Stage failures:     {step3:2}
      MoveJ IK changes:   {step1:2}

[PLANNING RESULT]
  Status:          SUCCESS
  Success planner: Pilz-PTP
  Success attempt: 3
  Success IK idx:  [0, 2]
  Total duration:  1773.88 ms

[BACKTRACK HISTORY] (last 2 events)
  #1 smart_backtrack: MoveL@3 failed -> changed MoveJ@1 IK 0->1
  #2 smart_backtrack: MoveL@3 failed -> changed MoveJ@1 IK 1->2

[ATTEMPT HISTORY] (3 attempts)
  Format: #attempt [phase] IK=[indices] -> result
  ---------------------------------------------------------------
  #  1 [Pilz-PTP] IK=[0,0] -> FAILED: MoveL at step 3 (move_l_3) - Stage 'move_l_3' failed to find solution
  #  2 [Pilz-PTP] IK=[0,1] -> FAILED: MoveL at step 3 (move_l_3) - Stage 'move_l_3' failed to find solution
  #  3 [Pilz-PTP] IK=[0,2] -> SUCCESS

[EXECUTION]
  Trajectories:    6
  Duration:        15849.43 ms
  Status:          SUCCESS

[SUMMARY]
  2026-01-13T07:40:28.417 | PLAN_OK | EXEC_OK | Steps:6 | IK:1024 | Pilz-PTP@3 | BT:2/0 | Plan:1773.88ms | Exec:15849.43ms
================================================================================


================================================================================
PLANNING SESSION: a9fe3404
Timestamp: 2026-01-13T07:40:46.052
================================================================================

[INPUT]
  Total motion steps:    5
  MoveJ steps:           2
  MoveL steps:           3
  Gripper operations:    2
  IK solutions/step:     [32, 32]
  Total IK combinations: 1024

[MOVEJ IK DETAILS]
  Step 0 (robot2):
    Total IK found:       32
    Collision-free IK:    32
  Step 1 (robot1):
    Total IK found:       32
    Collision-free IK:    32

[CONFIG]
  Max Pilz combinations: 16
  Max OMPL combinations: 1024
  Pilz PTP timeout:      10.00 s
  OMPL timeout:          3.00 s
  OMPL planner:          RRTConnect

[PLANNING PHASES]
  Phase 1: Pilz-PTP
    Attempts:         1 / 16
    Duration:         158.04 ms
    Result:           SUCCESS

[PLANNING RESULT]
  Status:          SUCCESS
  Success planner: Pilz-PTP
  Success attempt: 1
  Success IK idx:  [0, 0]
  Total duration:  1379.33 ms

[ATTEMPT HISTORY] (1 attempts)
  Format: #attempt [phase] IK=[indices] -> result
  ---------------------------------------------------------------
  #  1 [Pilz-PTP] IK=[0,0] -> SUCCESS

[EXECUTION]
  Trajectories:    5
  Duration:        16699.78 ms
  Status:          SUCCESS

[SUMMARY]
  2026-01-13T07:40:46.052 | PLAN_OK | EXEC_OK | Steps:5 | IK:1024 | Pilz-PTP@1 | Plan:1379.33ms | Exec:16699.78ms
================================================================================


================================================================================
PLANNING SESSION: 31242224
Timestamp: 2026-01-13T07:41:04.144
================================================================================

[INPUT]
  Total motion steps:    5
  MoveJ steps:           2
  MoveL steps:           3
  Gripper operations:    2
  IK solutions/step:     [32, 32]
  Total IK combinations: 1024

[MOVEJ IK DETAILS]
  Step 0 (robot2):
    Total IK found:       32
    Collision-free IK:    32
  Step 1 (robot1):
    Total IK found:       32
    Collision-free IK:    32

[CONFIG]
  Max Pilz combinations: 16
  Max OMPL combinations: 1024
  Pilz PTP timeout:      10.00 s
  OMPL timeout:          3.00 s
  OMPL planner:          RRTConnect

[PLANNING PHASES]
  Phase 1: Pilz-PTP
    Attempts:         1 / 16
    Duration:         168.99 ms
    Result:           SUCCESS

[PLANNING RESULT]
  Status:          SUCCESS
  Success planner: Pilz-PTP
  Success attempt: 1
  Success IK idx:  [0, 0]
  Total duration:  1538.81 ms

[ATTEMPT HISTORY] (1 attempts)
  Format: #attempt [phase] IK=[indices] -> result
  ---------------------------------------------------------------
  #  1 [Pilz-PTP] IK=[0,0] -> SUCCESS

[EXECUTION]
  Trajectories:    5
  Duration:        20596.61 ms
  Status:          SUCCESS

[SUMMARY]
  2026-01-13T07:41:04.144 | PLAN_OK | EXEC_OK | Steps:5 | IK:1024 | Pilz-PTP@1 | Plan:1538.81ms | Exec:20596.61ms
================================================================================


================================================================================
PLANNING SESSION: 259e7466
Timestamp: 2026-01-13T07:41:26.292
================================================================================

[INPUT]
  Total motion steps:    5
  MoveJ steps:           2
  MoveL steps:           3
  Gripper operations:    2
  IK solutions/step:     [32, 32]
  Total IK combinations: 1024

[MOVEJ IK DETAILS]
  Step 0 (robot2):
    Total IK found:       32
    Collision-free IK:    32
  Step 1 (robot1):
    Total IK found:       32
    Collision-free IK:    32

[CONFIG]
  Max Pilz combinations: 16
  Max OMPL combinations: 1024
  Pilz PTP timeout:      10.00 s
  OMPL timeout:          3.00 s
  OMPL planner:          RRTConnect

[PLANNING PHASES]
  Phase 1: Pilz-PTP
    Attempts:         1 / 16
    Duration:         155.81 ms
    Result:           SUCCESS

[PLANNING RESULT]
  Status:          SUCCESS
  Success planner: Pilz-PTP
  Success attempt: 1
  Success IK idx:  [0, 0]
  Total duration:  1378.37 ms

[ATTEMPT HISTORY] (1 attempts)
  Format: #attempt [phase] IK=[indices] -> result
  ---------------------------------------------------------------
  #  1 [Pilz-PTP] IK=[0,0] -> SUCCESS

[EXECUTION]
  Trajectories:    5
  Duration:        17199.54 ms
  Status:          SUCCESS

[SUMMARY]
  2026-01-13T07:41:26.292 | PLAN_OK | EXEC_OK | Steps:5 | IK:1024 | Pilz-PTP@1 | Plan:1378.37ms | Exec:17199.54ms
================================================================================


================================================================================
PLANNING SESSION: d7da3394
Timestamp: 2026-01-13T07:41:44.884
================================================================================

[INPUT]
  Total motion steps:    6
  MoveJ steps:           2
  MoveL steps:           4
  Gripper operations:    2
  IK solutions/step:     [32, 32]
  Total IK combinations: 1024

[MOVEJ IK DETAILS]
  Step 0 (robot1):
    Total IK found:       32
    Collision-free IK:    32
  Step 1 (robot2):
    Total IK found:       32
    Collision-free IK:    32

[CONFIG]
  Max Pilz combinations: 16
  Max OMPL combinations: 1024
  Pilz PTP timeout:      10.00 s
  OMPL timeout:          3.00 s
  OMPL planner:          RRTConnect

[PLANNING PHASES]
  Phase 1: Pilz-PTP
    Attempts:         1 / 16
    Duration:         164.94 ms
    Result:           SUCCESS

[PLANNING RESULT]
  Status:          SUCCESS
  Success planner: Pilz-PTP
  Success attempt: 1
  Success IK idx:  [0, 0]
  Total duration:  1618.39 ms

[ATTEMPT HISTORY] (1 attempts)
  Format: #attempt [phase] IK=[indices] -> result
  ---------------------------------------------------------------
  #  1 [Pilz-PTP] IK=[0,0] -> SUCCESS

[EXECUTION]
  Trajectories:    6
  Duration:        16647.85 ms
  Status:          SUCCESS

[SUMMARY]
  2026-01-13T07:41:44.884 | PLAN_OK | EXEC_OK | Steps:6 | IK:1024 | Pilz-PTP@1 | Plan:1618.39ms | Exec:16647.85ms
================================================================================


================================================================================
PLANNING SESSION: fecde5e6
Timestamp: 2026-01-13T07:42:03.162
================================================================================

[INPUT]
  Total motion steps:    5
  MoveJ steps:           2
  MoveL steps:           3
  Gripper operations:    2
  IK solutions/step:     [32, 32]
  Total IK combinations: 1024

[MOVEJ IK DETAILS]
  Step 0 (robot1):
    Total IK found:       32
    Collision-free IK:    32
  Step 1 (robot2):
    Total IK found:       32
    Collision-free IK:    32

[CONFIG]
  Max Pilz combinations: 16
  Max OMPL combinations: 1024
  Pilz PTP timeout:      10.00 s
  OMPL timeout:          3.00 s
  OMPL planner:          RRTConnect

[PLANNING PHASES]
  Phase 1: Pilz-PTP
    Attempts:         2 / 16
    Duration:         194.91 ms
    Result:           SUCCESS
    [Backtracking]
      Smart backtracks:   1
      Standard advances:  0
      Stage failures:     {step0:1}
      MoveJ IK changes:   {step0:1}

[PLANNING RESULT]
  Status:          SUCCESS
  Success planner: Pilz-PTP
  Success attempt: 2
  Success IK idx:  [1, 0]
  Total duration:  1345.97 ms

[BACKTRACK HISTORY] (last 1 events)
  #1 smart_backtrack: MoveL@0 failed -> changed MoveJ@0 IK 0->1

[ATTEMPT HISTORY] (2 attempts)
  Format: #attempt [phase] IK=[indices] -> result
  ---------------------------------------------------------------
  #  1 [Pilz-PTP] IK=[0,0] -> FAILED: MoveJ at step 0 (move_j_0) - Stage 'move_j_0' failed to find solution
  #  2 [Pilz-PTP] IK=[1,0] -> SUCCESS

[EXECUTION]
  Trajectories:    5
  Duration:        19221.27 ms
  Status:          SUCCESS

[SUMMARY]
  2026-01-13T07:42:03.162 | PLAN_OK | EXEC_OK | Steps:5 | IK:1024 | Pilz-PTP@2 | BT:1/0 | Plan:1345.97ms | Exec:19221.27ms
================================================================================


================================================================================
PLANNING SESSION: ae7141f1
Timestamp: 2026-01-13T07:42:23.741
================================================================================

[INPUT]
  Total motion steps:    5
  MoveJ steps:           2
  MoveL steps:           3
  Gripper operations:    2
  IK solutions/step:     [32, 32]
  Total IK combinations: 1024

[MOVEJ IK DETAILS]
  Step 0 (robot1):
    Total IK found:       32
    Collision-free IK:    32
  Step 1 (robot2):
    Total IK found:       32
    Collision-free IK:    32

[CONFIG]
  Max Pilz combinations: 16
  Max OMPL combinations: 1024
  Pilz PTP timeout:      10.00 s
  OMPL timeout:          3.00 s
  OMPL planner:          RRTConnect

[PLANNING PHASES]
  Phase 1: Pilz-PTP
    Attempts:         1 / 16
    Duration:         159.20 ms
    Result:           SUCCESS

[PLANNING RESULT]
  Status:          SUCCESS
  Success planner: Pilz-PTP
  Success attempt: 1
  Success IK idx:  [0, 0]
  Total duration:  1349.76 ms

[ATTEMPT HISTORY] (1 attempts)
  Format: #attempt [phase] IK=[indices] -> result
  ---------------------------------------------------------------
  #  1 [Pilz-PTP] IK=[0,0] -> SUCCESS

[EXECUTION]
  Trajectories:    5
  Duration:        14054.74 ms
  Status:          SUCCESS

[SUMMARY]
  2026-01-13T07:42:23.741 | PLAN_OK | EXEC_OK | Steps:5 | IK:1024 | Pilz-PTP@1 | Plan:1349.76ms | Exec:14054.74ms
================================================================================


================================================================================
PLANNING SESSION: da32e6df
Timestamp: 2026-01-13T07:42:39.164
================================================================================

[INPUT]
  Total motion steps:    6
  MoveJ steps:           2
  MoveL steps:           4
  Gripper operations:    2
  IK solutions/step:     [32, 32]
  Total IK combinations: 1024

[MOVEJ IK DETAILS]
  Step 0 (robot2):
    Total IK found:       32
    Collision-free IK:    32
  Step 1 (robot1):
    Total IK found:       32
    Collision-free IK:    32

[CONFIG]
  Max Pilz combinations: 16
  Max OMPL combinations: 1024
  Pilz PTP timeout:      10.00 s
  OMPL timeout:          3.00 s
  OMPL planner:          RRTConnect

[PLANNING PHASES]
  Phase 1: Pilz-PTP
    Attempts:         3 / 16
    Duration:         254.61 ms
    Result:           SUCCESS
    [Backtracking]
      Smart backtracks:   2
      Standard advances:  0
      Stage failures:     {step3:2}
      MoveJ IK changes:   {step1:2}

[PLANNING RESULT]
  Status:          SUCCESS
  Success planner: Pilz-PTP
  Success attempt: 3
  Success IK idx:  [0, 2]
  Total duration:  1726.39 ms

[BACKTRACK HISTORY] (last 2 events)
  #1 smart_backtrack: MoveL@3 failed -> changed MoveJ@1 IK 0->1
  #2 smart_backtrack: MoveL@3 failed -> changed MoveJ@1 IK 1->2

[ATTEMPT HISTORY] (3 attempts)
  Format: #attempt [phase] IK=[indices] -> result
  ---------------------------------------------------------------
  #  1 [Pilz-PTP] IK=[0,0] -> FAILED: MoveL at step 3 (move_l_3) - Stage 'move_l_3' failed to find solution
  #  2 [Pilz-PTP] IK=[0,1] -> FAILED: MoveL at step 3 (move_l_3) - Stage 'move_l_3' failed to find solution
  #  3 [Pilz-PTP] IK=[0,2] -> SUCCESS

[EXECUTION]
  Trajectories:    6
  Duration:        21148.28 ms
  Status:          SUCCESS

[SUMMARY]
  2026-01-13T07:42:39.164 | PLAN_OK | EXEC_OK | Steps:6 | IK:1024 | Pilz-PTP@3 | BT:2/0 | Plan:1726.39ms | Exec:21148.28ms
================================================================================


================================================================================
PLANNING SESSION: 519de08e
Timestamp: 2026-01-13T07:43:02.051
================================================================================

[INPUT]
  Total motion steps:    5
  MoveJ steps:           2
  MoveL steps:           3
  Gripper operations:    2
  IK solutions/step:     [32, 32]
  Total IK combinations: 1024

[MOVEJ IK DETAILS]
  Step 0 (robot2):
    Total IK found:       32
    Collision-free IK:    32
  Step 1 (robot1):
    Total IK found:       32
    Collision-free IK:    32

[CONFIG]
  Max Pilz combinations: 16
  Max OMPL combinations: 1024
  Pilz PTP timeout:      10.00 s
  OMPL timeout:          3.00 s
  OMPL planner:          RRTConnect

[PLANNING PHASES]
  Phase 1: Pilz-PTP
    Attempts:         1 / 16
    Duration:         161.69 ms
    Result:           SUCCESS

[PLANNING RESULT]
  Status:          SUCCESS
  Success planner: Pilz-PTP
  Success attempt: 1
  Success IK idx:  [0, 0]
  Total duration:  1391.20 ms

[ATTEMPT HISTORY] (1 attempts)
  Format: #attempt [phase] IK=[indices] -> result
  ---------------------------------------------------------------
  #  1 [Pilz-PTP] IK=[0,0] -> SUCCESS

[EXECUTION]
  Trajectories:    5
  Duration:        14348.76 ms
  Status:          SUCCESS

[SUMMARY]
  2026-01-13T07:43:02.051 | PLAN_OK | EXEC_OK | Steps:5 | IK:1024 | Pilz-PTP@1 | Plan:1391.20ms | Exec:14348.76ms
================================================================================


================================================================================
PLANNING SESSION: b458aa4a
Timestamp: 2026-01-13T07:43:17.802
================================================================================

[INPUT]
  Total motion steps:    5
  MoveJ steps:           2
  MoveL steps:           3
  Gripper operations:    2
  IK solutions/step:     [32, 32]
  Total IK combinations: 1024

[MOVEJ IK DETAILS]
  Step 0 (robot2):
    Total IK found:       32
    Collision-free IK:    32
  Step 1 (robot1):
    Total IK found:       32
    Collision-free IK:    32

[CONFIG]
  Max Pilz combinations: 16
  Max OMPL combinations: 1024
  Pilz PTP timeout:      10.00 s
  OMPL timeout:          3.00 s
  OMPL planner:          RRTConnect

[PLANNING PHASES]
  Phase 1: Pilz-PTP
    Attempts:         1 / 16
    Duration:         156.13 ms
    Result:           SUCCESS

[PLANNING RESULT]
  Status:          SUCCESS
  Success planner: Pilz-PTP
  Success attempt: 1
  Success IK idx:  [0, 0]
  Total duration:  1436.62 ms

[ATTEMPT HISTORY] (1 attempts)
  Format: #attempt [phase] IK=[indices] -> result
  ---------------------------------------------------------------
  #  1 [Pilz-PTP] IK=[0,0] -> SUCCESS

[EXECUTION]
  Trajectories:    5
  Duration:        15961.54 ms
  Status:          SUCCESS

[SUMMARY]
  2026-01-13T07:43:17.802 | PLAN_OK | EXEC_OK | Steps:5 | IK:1024 | Pilz-PTP@1 | Plan:1436.62ms | Exec:15961.54ms
================================================================================


================================================================================
PLANNING SESSION: 9eb8ce5b
Timestamp: 2026-01-13T07:43:35.215
================================================================================

[INPUT]
  Total motion steps:    5
  MoveJ steps:           2
  MoveL steps:           3
  Gripper operations:    2
  IK solutions/step:     [32, 32]
  Total IK combinations: 1024

[MOVEJ IK DETAILS]
  Step 0 (robot2):
    Total IK found:       32
    Collision-free IK:    32
  Step 1 (robot1):
    Total IK found:       32
    Collision-free IK:    32

[CONFIG]
  Max Pilz combinations: 16
  Max OMPL combinations: 1024
  Pilz PTP timeout:      10.00 s
  OMPL timeout:          3.00 s
  OMPL planner:          RRTConnect

[PLANNING PHASES]
  Phase 1: Pilz-PTP
    Attempts:         1 / 16
    Duration:         159.54 ms
    Result:           SUCCESS

[PLANNING RESULT]
  Status:          SUCCESS
  Success planner: Pilz-PTP
  Success attempt: 1
  Success IK idx:  [0, 0]
  Total duration:  1468.70 ms

[ATTEMPT HISTORY] (1 attempts)
  Format: #attempt [phase] IK=[indices] -> result
  ---------------------------------------------------------------
  #  1 [Pilz-PTP] IK=[0,0] -> SUCCESS

[EXECUTION]
  Trajectories:    5
  Duration:        19456.44 ms
  Status:          SUCCESS

[SUMMARY]
  2026-01-13T07:43:35.215 | PLAN_OK | EXEC_OK | Steps:5 | IK:1024 | Pilz-PTP@1 | Plan:1468.70ms | Exec:19456.44ms
================================================================================


================================================================================
PLANNING SESSION: 16876e90
Timestamp: 2026-01-13T07:43:56.152
================================================================================

[INPUT]
  Total motion steps:    5
  MoveJ steps:           2
  MoveL steps:           3
  Gripper operations:    2
  IK solutions/step:     [32, 32]
  Total IK combinations: 1024

[MOVEJ IK DETAILS]
  Step 0 (robot2):
    Total IK found:       32
    Collision-free IK:    32
  Step 1 (robot1):
    Total IK found:       32
    Collision-free IK:    32

[CONFIG]
  Max Pilz combinations: 16
  Max OMPL combinations: 1024
  Pilz PTP timeout:      10.00 s
  OMPL timeout:          3.00 s
  OMPL planner:          RRTConnect

[PLANNING PHASES]
  Phase 1: Pilz-PTP
    Attempts:         3 / 16
    Duration:         242.64 ms
    Result:           SUCCESS
    [Backtracking]
      Smart backtracks:   2
      Standard advances:  0
      Stage failures:     {step1:1, step3:1}
      MoveJ IK changes:   {step1:2}

[PLANNING RESULT]
  Status:          SUCCESS
  Success planner: Pilz-PTP
  Success attempt: 3
  Success IK idx:  [0, 2]
  Total duration:  1514.86 ms

[BACKTRACK HISTORY] (last 2 events)
  #1 smart_backtrack: MoveL@3 failed -> changed MoveJ@1 IK 0->1
  #2 smart_backtrack: MoveL@1 failed -> changed MoveJ@1 IK 1->2

[ATTEMPT HISTORY] (3 attempts)
  Format: #attempt [phase] IK=[indices] -> result
  ---------------------------------------------------------------
  #  1 [Pilz-PTP] IK=[0,0] -> FAILED: MoveL at step 3 (move_l_3) - Stage 'move_l_3' failed to find solution
  #  2 [Pilz-PTP] IK=[0,1] -> FAILED: MoveJ at step 1 (move_j_1) - Stage 'move_j_1' failed to find solution
  #  3 [Pilz-PTP] IK=[0,2] -> SUCCESS

[EXECUTION]
  Trajectories:    5
  Duration:        22750.75 ms
  Status:          SUCCESS

[SUMMARY]
  2026-01-13T07:43:56.152 | PLAN_OK | EXEC_OK | Steps:5 | IK:1024 | Pilz-PTP@3 | BT:2/0 | Plan:1514.86ms | Exec:22750.75ms
================================================================================


================================================================================
PLANNING SESSION: addddb38
Timestamp: 2026-01-13T07:44:20.434
================================================================================

[INPUT]
  Total motion steps:    6
  MoveJ steps:           2
  MoveL steps:           4
  Gripper operations:    2
  IK solutions/step:     [32, 32]
  Total IK combinations: 1024

[MOVEJ IK DETAILS]
  Step 0 (robot1):
    Total IK found:       32
    Collision-free IK:    32
  Step 1 (robot2):
    Total IK found:       32
    Collision-free IK:    32

[CONFIG]
  Max Pilz combinations: 16
  Max OMPL combinations: 1024
  Pilz PTP timeout:      10.00 s
  OMPL timeout:          3.00 s
  OMPL planner:          RRTConnect

[PLANNING PHASES]
  Phase 1: Pilz-PTP
    Attempts:         1 / 16
    Duration:         160.37 ms
    Result:           SUCCESS

[PLANNING RESULT]
  Status:          SUCCESS
  Success planner: Pilz-PTP
  Success attempt: 1
  Success IK idx:  [0, 0]
  Total duration:  1643.94 ms

[ATTEMPT HISTORY] (1 attempts)
  Format: #attempt [phase] IK=[indices] -> result
  ---------------------------------------------------------------
  #  1 [Pilz-PTP] IK=[0,0] -> SUCCESS

[EXECUTION]
  Trajectories:    6
  Duration:        15391.81 ms
  Status:          SUCCESS

[SUMMARY]
  2026-01-13T07:44:20.434 | PLAN_OK | EXEC_OK | Steps:6 | IK:1024 | Pilz-PTP@1 | Plan:1643.94ms | Exec:15391.81ms
================================================================================


================================================================================
PLANNING SESSION: 5c8ababc
Timestamp: 2026-01-13T07:44:37.482
================================================================================

[INPUT]
  Total motion steps:    5
  MoveJ steps:           2
  MoveL steps:           3
  Gripper operations:    2
  IK solutions/step:     [32, 32]
  Total IK combinations: 1024

[MOVEJ IK DETAILS]
  Step 0 (robot1):
    Total IK found:       32
    Collision-free IK:    32
  Step 1 (robot2):
    Total IK found:       32
    Collision-free IK:    32

[CONFIG]
  Max Pilz combinations: 16
  Max OMPL combinations: 1024
  Pilz PTP timeout:      10.00 s
  OMPL timeout:          3.00 s
  OMPL planner:          RRTConnect

[PLANNING PHASES]
  Phase 1: Pilz-PTP
    Attempts:         1 / 16
    Duration:         160.76 ms
    Result:           SUCCESS

[PLANNING RESULT]
  Status:          SUCCESS
  Success planner: Pilz-PTP
  Success attempt: 1
  Success IK idx:  [0, 0]
  Total duration:  1241.49 ms

[ATTEMPT HISTORY] (1 attempts)
  Format: #attempt [phase] IK=[indices] -> result
  ---------------------------------------------------------------
  #  1 [Pilz-PTP] IK=[0,0] -> SUCCESS

[EXECUTION]
  Trajectories:    5
  Duration:        16745.66 ms
  Status:          SUCCESS

[SUMMARY]
  2026-01-13T07:44:37.482 | PLAN_OK | EXEC_OK | Steps:5 | IK:1024 | Pilz-PTP@1 | Plan:1241.49ms | Exec:16745.66ms
================================================================================


================================================================================
PLANNING SESSION: e6d77659
Timestamp: 2026-01-13T07:44:55.486
================================================================================

[INPUT]
  Total motion steps:    6
  MoveJ steps:           2
  MoveL steps:           4
  Gripper operations:    2
  IK solutions/step:     [32, 32]
  Total IK combinations: 1024

[MOVEJ IK DETAILS]
  Step 0 (robot2):
    Total IK found:       32
    Collision-free IK:    32
  Step 1 (robot1):
    Total IK found:       32
    Collision-free IK:    32

[CONFIG]
  Max Pilz combinations: 16
  Max OMPL combinations: 1024
  Pilz PTP timeout:      10.00 s
  OMPL timeout:          3.00 s
  OMPL planner:          RRTConnect

[PLANNING PHASES]
  Phase 1: Pilz-PTP
    Attempts:         1 / 16
    Duration:         159.24 ms
    Result:           SUCCESS

[PLANNING RESULT]
  Status:          SUCCESS
  Success planner: Pilz-PTP
  Success attempt: 1
  Success IK idx:  [0, 0]
  Total duration:  1634.46 ms

[ATTEMPT HISTORY] (1 attempts)
  Format: #attempt [phase] IK=[indices] -> result
  ---------------------------------------------------------------
  #  1 [Pilz-PTP] IK=[0,0] -> SUCCESS

[EXECUTION]
  Trajectories:    6
  Duration:        18249.78 ms
  Status:          SUCCESS

[SUMMARY]
  2026-01-13T07:44:55.486 | PLAN_OK | EXEC_OK | Steps:6 | IK:1024 | Pilz-PTP@1 | Plan:1634.46ms | Exec:18249.78ms
================================================================================


================================================================================
PLANNING SESSION: 1601133a
Timestamp: 2026-01-13T07:45:15.381
================================================================================

[INPUT]
  Total motion steps:    5
  MoveJ steps:           2
  MoveL steps:           3
  Gripper operations:    2
  IK solutions/step:     [32, 32]
  Total IK combinations: 1024

[MOVEJ IK DETAILS]
  Step 0 (robot2):
    Total IK found:       32
    Collision-free IK:    32
  Step 1 (robot1):
    Total IK found:       32
    Collision-free IK:    32

[CONFIG]
  Max Pilz combinations: 16
  Max OMPL combinations: 1024
  Pilz PTP timeout:      10.00 s
  OMPL timeout:          3.00 s
  OMPL planner:          RRTConnect

[PLANNING PHASES]
  Phase 1: Pilz-PTP
    Attempts:         1 / 16
    Duration:         159.91 ms
    Result:           SUCCESS

[PLANNING RESULT]
  Status:          SUCCESS
  Success planner: Pilz-PTP
  Success attempt: 1
  Success IK idx:  [0, 0]
  Total duration:  1430.37 ms

[ATTEMPT HISTORY] (1 attempts)
  Format: #attempt [phase] IK=[indices] -> result
  ---------------------------------------------------------------
  #  1 [Pilz-PTP] IK=[0,0] -> SUCCESS

[EXECUTION]
  Trajectories:    5
  Duration:        15299.23 ms
  Status:          SUCCESS

[SUMMARY]
  2026-01-13T07:45:15.381 | PLAN_OK | EXEC_OK | Steps:5 | IK:1024 | Pilz-PTP@1 | Plan:1430.37ms | Exec:15299.23ms
================================================================================


================================================================================
PLANNING SESSION: 548d8afd
Timestamp: 2026-01-13T07:45:32.125
================================================================================

[INPUT]
  Total motion steps:    6
  MoveJ steps:           2
  MoveL steps:           4
  Gripper operations:    2
  IK solutions/step:     [32, 32]
  Total IK combinations: 1024

[MOVEJ IK DETAILS]
  Step 0 (robot1):
    Total IK found:       32
    Collision-free IK:    32
  Step 1 (robot2):
    Total IK found:       32
    Collision-free IK:    32

[CONFIG]
  Max Pilz combinations: 16
  Max OMPL combinations: 1024
  Pilz PTP timeout:      10.00 s
  OMPL timeout:          3.00 s
  OMPL planner:          RRTConnect

[PLANNING PHASES]
  Phase 1: Pilz-PTP
    Attempts:         1 / 16
    Duration:         165.89 ms
    Result:           SUCCESS

[PLANNING RESULT]
  Status:          SUCCESS
  Success planner: Pilz-PTP
  Success attempt: 1
  Success IK idx:  [0, 0]
  Total duration:  1639.40 ms

[ATTEMPT HISTORY] (1 attempts)
  Format: #attempt [phase] IK=[indices] -> result
  ---------------------------------------------------------------
  #  1 [Pilz-PTP] IK=[0,0] -> SUCCESS

[EXECUTION]
  Trajectories:    6
  Duration:        22092.58 ms
  Status:          SUCCESS

[SUMMARY]
  2026-01-13T07:45:32.125 | PLAN_OK | EXEC_OK | Steps:6 | IK:1024 | Pilz-PTP@1 | Plan:1639.40ms | Exec:22092.58ms
================================================================================


================================================================================
PLANNING SESSION: 6df9f7ef
Timestamp: 2026-01-13T07:45:55.871
================================================================================

[INPUT]
  Total motion steps:    5
  MoveJ steps:           2
  MoveL steps:           3
  Gripper operations:    2
  IK solutions/step:     [32, 32]
  Total IK combinations: 1024

[MOVEJ IK DETAILS]
  Step 0 (robot1):
    Total IK found:       32
    Collision-free IK:    32
  Step 1 (robot2):
    Total IK found:       32
    Collision-free IK:    32

[CONFIG]
  Max Pilz combinations: 16
  Max OMPL combinations: 1024
  Pilz PTP timeout:      10.00 s
  OMPL timeout:          3.00 s
  OMPL planner:          RRTConnect

[PLANNING PHASES]
  Phase 1: Pilz-PTP
    Attempts:         2 / 16
    Duration:         193.86 ms
    Result:           SUCCESS
    [Backtracking]
      Smart backtracks:   1
      Standard advances:  0
      Stage failures:     {step0:1}
      MoveJ IK changes:   {step0:1}

[PLANNING RESULT]
  Status:          SUCCESS
  Success planner: Pilz-PTP
  Success attempt: 2
  Success IK idx:  [1, 0]
  Total duration:  1366.03 ms

[BACKTRACK HISTORY] (last 1 events)
  #1 smart_backtrack: MoveL@0 failed -> changed MoveJ@0 IK 0->1

[ATTEMPT HISTORY] (2 attempts)
  Format: #attempt [phase] IK=[indices] -> result
  ---------------------------------------------------------------
  #  1 [Pilz-PTP] IK=[0,0] -> FAILED: MoveJ at step 0 (move_j_0) - Stage 'move_j_0' failed to find solution
  #  2 [Pilz-PTP] IK=[1,0] -> SUCCESS

[EXECUTION]
  Trajectories:    5
  Duration:        19201.84 ms
  Status:          SUCCESS

[SUMMARY]
  2026-01-13T07:45:55.871 | PLAN_OK | EXEC_OK | Steps:5 | IK:1024 | Pilz-PTP@2 | BT:1/0 | Plan:1366.03ms | Exec:19201.84ms
================================================================================


================================================================================
PLANNING SESSION: 1b2e7e20
Timestamp: 2026-01-13T07:46:16.451
================================================================================

[INPUT]
  Total motion steps:    5
  MoveJ steps:           2
  MoveL steps:           3
  Gripper operations:    2
  IK solutions/step:     [32, 32]
  Total IK combinations: 1024

[MOVEJ IK DETAILS]
  Step 0 (robot1):
    Total IK found:       32
    Collision-free IK:    32
  Step 1 (robot2):
    Total IK found:       32
    Collision-free IK:    32

[CONFIG]
  Max Pilz combinations: 16
  Max OMPL combinations: 1024
  Pilz PTP timeout:      10.00 s
  OMPL timeout:          3.00 s
  OMPL planner:          RRTConnect

[PLANNING PHASES]
  Phase 1: Pilz-PTP
    Attempts:         2 / 16
    Duration:         191.37 ms
    Result:           SUCCESS
    [Backtracking]
      Smart backtracks:   1
      Standard advances:  0
      Stage failures:     {step1:1}
      MoveJ IK changes:   {step1:1}

[PLANNING RESULT]
  Status:          SUCCESS
  Success planner: Pilz-PTP
  Success attempt: 2
  Success IK idx:  [0, 1]
  Total duration:  1308.81 ms

[BACKTRACK HISTORY] (last 1 events)
  #1 smart_backtrack: MoveL@1 failed -> changed MoveJ@1 IK 0->1

[ATTEMPT HISTORY] (2 attempts)
  Format: #attempt [phase] IK=[indices] -> result
  ---------------------------------------------------------------
  #  1 [Pilz-PTP] IK=[0,0] -> FAILED: MoveJ at step 1 (move_j_1) - Stage 'move_j_1' failed to find solution
  #  2 [Pilz-PTP] IK=[0,1] -> SUCCESS

[EXECUTION]
  Trajectories:    5
  Duration:        20650.05 ms
  Status:          SUCCESS

[SUMMARY]
  2026-01-13T07:46:16.451 | PLAN_OK | EXEC_OK | Steps:5 | IK:1024 | Pilz-PTP@2 | BT:1/0 | Plan:1308.81ms | Exec:20650.05ms
================================================================================


================================================================================
PLANNING SESSION: ce29232a
Timestamp: 2026-01-13T07:46:38.423
================================================================================

[INPUT]
  Total motion steps:    6
  MoveJ steps:           2
  MoveL steps:           4
  Gripper operations:    2
  IK solutions/step:     [32, 32]
  Total IK combinations: 1024

[MOVEJ IK DETAILS]
  Step 0 (robot2):
    Total IK found:       32
    Collision-free IK:    32
  Step 1 (robot1):
    Total IK found:       32
    Collision-free IK:    32

[CONFIG]
  Max Pilz combinations: 16
  Max OMPL combinations: 1024
  Pilz PTP timeout:      10.00 s
  OMPL timeout:          3.00 s
  OMPL planner:          RRTConnect

[PLANNING PHASES]
  Phase 1: Pilz-PTP
    Attempts:         16 / 16
    Duration:         763.44 ms
    Result:           FAILED
    [Backtracking]
      Smart backtracks:   16
      Standard advances:  0
      Stage failures:     {step0:16}
      MoveJ IK changes:   {step0:16}
  Phase 2: OMPL
    Attempts:         17 / 1024
    Duration:         19691.94 ms
    Result:           SUCCESS
    [Backtracking]
      Smart backtracks:   16
      Standard advances:  0
      Stage failures:     {step0:14, step2:1, step3:1}
      MoveJ IK changes:   {step0:15, step1:1}

[PLANNING RESULT]
  Status:          SUCCESS
  Success planner: OMPL
  Success attempt: 17
  Success IK idx:  [15, 1]
  Total duration:  21930.69 ms

[BACKTRACK HISTORY] (last 32 events)
  #7 smart_backtrack: MoveL@3 failed -> changed MoveJ@1 IK 0->1
  #8 smart_backtrack: MoveL@0 failed -> changed MoveJ@0 IK 6->7
  #9 smart_backtrack: MoveL@0 failed -> changed MoveJ@0 IK 7->8
  #10 smart_backtrack: MoveL@0 failed -> changed MoveJ@0 IK 8->9
  #11 smart_backtrack: MoveL@0 failed -> changed MoveJ@0 IK 9->10
  #12 smart_backtrack: MoveL@0 failed -> changed MoveJ@0 IK 10->11
  #13 smart_backtrack: MoveL@0 failed -> changed MoveJ@0 IK 11->12
  #14 smart_backtrack: MoveL@0 failed -> changed MoveJ@0 IK 12->13
  #15 smart_backtrack: MoveL@0 failed -> changed MoveJ@0 IK 13->14
  #16 smart_backtrack: MoveL@0 failed -> changed MoveJ@0 IK 14->15

[ATTEMPT HISTORY] (33 attempts)
  Format: #attempt [phase] IK=[indices] -> result
  ---------------------------------------------------------------
  #  1 [Pilz-PTP] IK=[0,0] -> FAILED: MoveJ at step 0 (move_j_0) - Stage 'move_j_0' failed to find solution
  #  2 [Pilz-PTP] IK=[1,0] -> FAILED: MoveJ at step 0 (move_j_0) - Stage 'move_j_0' failed to find solution
  #  3 [Pilz-PTP] IK=[2,0] -> FAILED: MoveJ at step 0 (move_j_0) - Stage 'move_j_0' failed to find solution
  #  4 [Pilz-PTP] IK=[3,0] -> FAILED: MoveJ at step 0 (move_j_0) - Stage 'move_j_0' failed to find solution
  #  5 [Pilz-PTP] IK=[4,0] -> FAILED: MoveJ at step 0 (move_j_0) - Stage 'move_j_0' failed to find solution
  #  6 [Pilz-PTP] IK=[5,0] -> FAILED: MoveJ at step 0 (move_j_0) - Stage 'move_j_0' failed to find solution
  #  7 [Pilz-PTP] IK=[6,0] -> FAILED: MoveJ at step 0 (move_j_0) - Stage 'move_j_0' failed to find solution
  #  8 [Pilz-PTP] IK=[7,0] -> FAILED: MoveJ at step 0 (move_j_0) - Stage 'move_j_0' failed to find solution
  #  9 [Pilz-PTP] IK=[8,0] -> FAILED: MoveJ at step 0 (move_j_0) - Stage 'move_j_0' failed to find solution
  # 10 [Pilz-PTP] IK=[9,0] -> FAILED: MoveJ at step 0 (move_j_0) - Stage 'move_j_0' failed to find solution
  # 11 [Pilz-PTP] IK=[10,0] -> FAILED: MoveJ at step 0 (move_j_0) - Stage 'move_j_0' failed to find solution
  # 12 [Pilz-PTP] IK=[11,0] -> FAILED: MoveJ at step 0 (move_j_0) - Stage 'move_j_0' failed to find solution
  # 13 [Pilz-PTP] IK=[12,0] -> FAILED: MoveJ at step 0 (move_j_0) - Stage 'move_j_0' failed to find solution
  # 14 [Pilz-PTP] IK=[13,0] -> FAILED: MoveJ at step 0 (move_j_0) - Stage 'move_j_0' failed to find solution
  # 15 [Pilz-PTP] IK=[14,0] -> FAILED: MoveJ at step 0 (move_j_0) - Stage 'move_j_0' failed to find solution
  # 16 [Pilz-PTP] IK=[15,0] -> FAILED: MoveJ at step 0 (move_j_0) - Stage 'move_j_0' failed to find solution
  #  1 [    OMPL] IK=[0,0] -> FAILED: MoveJ at step 0 (move_j_0) - Stage 'move_j_0' failed to find solution
  #  2 [    OMPL] IK=[1,0] -> FAILED: MoveJ at step 0 (move_j_0) - Stage 'move_j_0' failed to find solution
  #  3 [    OMPL] IK=[2,0] -> FAILED: MoveJ at step 0 (move_j_0) - Stage 'move_j_0' failed to find solution
  #  4 [    OMPL] IK=[3,0] -> FAILED: MoveJ at step 0 (move_j_0) - Stage 'move_j_0' failed to find solution
  #  5 [    OMPL] IK=[4,0] -> FAILED: MoveL at step 2 (move_l_2) - Stage 'move_l_2' failed to find solution
  #  6 [    OMPL] IK=[5,0] -> FAILED: MoveJ at step 0 (move_j_0) - Stage 'move_j_0' failed to find solution
  #  7 [    OMPL] IK=[6,0] -> FAILED: MoveL at step 3 (move_l_3) - Stage 'move_l_3' failed to find solution
  #  8 [    OMPL] IK=[6,1] -> FAILED: MoveJ at step 0 (move_j_0) - Stage 'move_j_0' failed to find solution
  #  9 [    OMPL] IK=[7,1] -> FAILED: MoveJ at step 0 (move_j_0) - Stage 'move_j_0' failed to find solution
  # 10 [    OMPL] IK=[8,1] -> FAILED: MoveJ at step 0 (move_j_0) - Stage 'move_j_0' failed to find solution
  # 11 [    OMPL] IK=[9,1] -> FAILED: MoveJ at step 0 (move_j_0) - Stage 'move_j_0' failed to find solution
  # 12 [    OMPL] IK=[10,1] -> FAILED: MoveJ at step 0 (move_j_0) - Stage 'move_j_0' failed to find solution
  # 13 [    OMPL] IK=[11,1] -> FAILED: MoveJ at step 0 (move_j_0) - Stage 'move_j_0' failed to find solution
  # 14 [    OMPL] IK=[12,1] -> FAILED: MoveJ at step 0 (move_j_0) - Stage 'move_j_0' failed to find solution
  # 15 [    OMPL] IK=[13,1] -> FAILED: MoveJ at step 0 (move_j_0) - Stage 'move_j_0' failed to find solution
  # 16 [    OMPL] IK=[14,1] -> FAILED: MoveJ at step 0 (move_j_0) - Stage 'move_j_0' failed to find solution
  # 17 [    OMPL] IK=[15,1] -> SUCCESS

[EXECUTION]
  Trajectories:    6
  Duration:        28995.23 ms
  Status:          SUCCESS

[SUMMARY]
  2026-01-13T07:46:38.423 | PLAN_OK | EXEC_OK | Steps:6 | IK:1024 | OMPL@17 | BT:32/0 | Plan:21930.69ms | Exec:28995.23ms
================================================================================


================================================================================
PLANNING SESSION: 224b1bcf
Timestamp: 2026-01-13T07:47:29.362
================================================================================

[INPUT]
  Total motion steps:    3
  MoveJ steps:           1
  MoveL steps:           2
  Gripper operations:    1
  IK solutions/step:     [32]
  Total IK combinations: 32

[MOVEJ IK DETAILS]
  Step 0 (robot2):
    Total IK found:       32
    Collision-free IK:    32

[CONFIG]
  Max Pilz combinations: 16
  Max OMPL combinations: 1024
  Pilz PTP timeout:      10.00 s
  OMPL timeout:          3.00 s
  OMPL planner:          RRTConnect

[PLANNING PHASES]
  Phase 1: Pilz-PTP
    Attempts:         6 / 11
    Duration:         351.14 ms
    Result:           SUCCESS
    [Backtracking]
      Smart backtracks:   5
      Standard advances:  0
      Stage failures:     {step0:5}
      MoveJ IK changes:   {step0:5}

[PLANNING RESULT]
  Status:          SUCCESS
  Success planner: Pilz-PTP
  Success attempt: 6
  Success IK idx:  [14]
  Total duration:  396.84 ms

[BACKTRACK HISTORY] (last 5 events)
  #1 smart_backtrack: MoveL@0 failed -> changed MoveJ@0 IK 2->4
  #2 smart_backtrack: MoveL@0 failed -> changed MoveJ@0 IK 4->10
  #3 smart_backtrack: MoveL@0 failed -> changed MoveJ@0 IK 10->11
  #4 smart_backtrack: MoveL@0 failed -> changed MoveJ@0 IK 11->13
  #5 smart_backtrack: MoveL@0 failed -> changed MoveJ@0 IK 13->14

[ATTEMPT HISTORY] (6 attempts)
  Format: #attempt [phase] IK=[indices] -> result
  ---------------------------------------------------------------
  #  1 [Pilz-PTP] IK=[2] -> FAILED: MoveJ at step 0 (move_j_0) - Stage 'move_j_0' failed to find solution
  #  2 [Pilz-PTP] IK=[4] -> FAILED: MoveJ at step 0 (move_j_0) - Stage 'move_j_0' failed to find solution
  #  3 [Pilz-PTP] IK=[10] -> FAILED: MoveJ at step 0 (move_j_0) - Stage 'move_j_0' failed to find solution
  #  4 [Pilz-PTP] IK=[11] -> FAILED: MoveJ at step 0 (move_j_0) - Stage 'move_j_0' failed to find solution
  #  5 [Pilz-PTP] IK=[13] -> FAILED: MoveJ at step 0 (move_j_0) - Stage 'move_j_0' failed to find solution
  #  6 [Pilz-PTP] IK=[14] -> SUCCESS

[EXECUTION]
  Trajectories:    3
  Duration:        16819.57 ms
  Status:          SUCCESS

[SUMMARY]
  2026-01-13T07:47:29.362 | PLAN_OK | EXEC_OK | Steps:3 | IK:32 | Pilz-PTP@6 | BT:5/0 | Plan:396.84ms | Exec:16819.57ms
================================================================================

