
================================================================================
PLANNING SESSION: d137c7cd
Timestamp: 2026-01-12T23:14:15.923
================================================================================

[INPUT]
  Total motion steps:    3
  MoveJ steps:           1
  MoveL steps:           2
  Gripper operations:    1
  IK solutions/step:     [32]
  Total IK combinations: 32

[MOVEJ IK DETAILS]
  Step 0 (robot2):
    Total IK found:       32
    Collision-free IK:    32

[CONFIG]
  Max Pilz combinations: 16
  Max OMPL combinations: 1024
  Pilz PTP timeout:      10.00 s
  OMPL timeout:          3.00 s
  OMPL planner:          RRTConnect

[PLANNING PHASES]
  Phase 1: Pilz-PTP
    Attempts:         1 / 32
    Duration:         162.93 ms
    Result:           SUCCESS

[PLANNING RESULT]
  Status:          SUCCESS
  Success planner: Pilz-PTP
  Success attempt: 1
  Success IK idx:  [0]
  Total duration:  268.43 ms

[ATTEMPT HISTORY] (1 attempts)
  Format: #attempt [phase] IK=[indices] -> result
  ---------------------------------------------------------------
  #  1 [Pilz-PTP] IK=[0] -> SUCCESS

[EXECUTION]
  Trajectories:    3
  Duration:        9712.58 ms
  Status:          SUCCESS

[SUMMARY]
  2026-01-12T23:14:15.923 | PLAN_OK | EXEC_OK | Steps:3 | IK:32 | Pilz-PTP@1 | Plan:268.43ms | Exec:9712.58ms
================================================================================


================================================================================
PLANNING SESSION: 24c45192
Timestamp: 2026-01-12T23:14:25.919
================================================================================

[INPUT]
  Total motion steps:    1
  MoveJ steps:           1
  MoveL steps:           0
  Gripper operations:    0
  IK solutions/step:     [32]
  Total IK combinations: 32

[MOVEJ IK DETAILS]
  Step 0 (robot2):
    Total IK found:       32
    Collision-free IK:    32

[CONFIG]
  Max Pilz combinations: 16
  Max OMPL combinations: 1024
  Pilz PTP timeout:      10.00 s
  OMPL timeout:          3.00 s
  OMPL planner:          RRTConnect

[PLANNING PHASES]
  Phase 1: Pilz-PTP
    Attempts:         1 / 32
    Duration:         162.89 ms
    Result:           SUCCESS

[PLANNING RESULT]
  Status:          SUCCESS
  Success planner: Pilz-PTP
  Success attempt: 1
  Success IK idx:  [0]
  Total duration:  219.57 ms

[ATTEMPT HISTORY] (1 attempts)
  Format: #attempt [phase] IK=[indices] -> result
  ---------------------------------------------------------------
  #  1 [Pilz-PTP] IK=[0] -> SUCCESS

[EXECUTION]
  Trajectories:    1
  Duration:        3285.02 ms
  Status:          SUCCESS

[SUMMARY]
  2026-01-12T23:14:25.919 | PLAN_OK | EXEC_OK | Steps:1 | IK:32 | Pilz-PTP@1 | Plan:219.57ms | Exec:3285.02ms
================================================================================


================================================================================
PLANNING SESSION: 5a5bd446
Timestamp: 2026-01-12T23:14:29.943
================================================================================

[INPUT]
  Total motion steps:    1
  MoveJ steps:           1
  MoveL steps:           0
  Gripper operations:    0
  IK solutions/step:     [32]
  Total IK combinations: 32

[MOVEJ IK DETAILS]
  Step 0 (robot2):
    Total IK found:       32
    Collision-free IK:    32

[CONFIG]
  Max Pilz combinations: 16
  Max OMPL combinations: 1024
  Pilz PTP timeout:      10.00 s
  OMPL timeout:          3.00 s
  OMPL planner:          RRTConnect

[PLANNING PHASES]
  Phase 1: Pilz-PTP
    Attempts:         1 / 32
    Duration:         157.79 ms
    Result:           SUCCESS

[PLANNING RESULT]
  Status:          SUCCESS
  Success planner: Pilz-PTP
  Success attempt: 1
  Success IK idx:  [0]
  Total duration:  295.21 ms

[ATTEMPT HISTORY] (1 attempts)
  Format: #attempt [phase] IK=[indices] -> result
  ---------------------------------------------------------------
  #  1 [Pilz-PTP] IK=[0] -> SUCCESS

[EXECUTION]
  Trajectories:    1
  Duration:        3785.35 ms
  Status:          SUCCESS

[SUMMARY]
  2026-01-12T23:14:29.943 | PLAN_OK | EXEC_OK | Steps:1 | IK:32 | Pilz-PTP@1 | Plan:295.21ms | Exec:3785.35ms
================================================================================


================================================================================
PLANNING SESSION: e0c29a62
Timestamp: 2026-01-12T23:14:34.545
================================================================================

[INPUT]
  Total motion steps:    1
  MoveJ steps:           1
  MoveL steps:           0
  Gripper operations:    0
  IK solutions/step:     [32]
  Total IK combinations: 32

[MOVEJ IK DETAILS]
  Step 0 (robot2):
    Total IK found:       32
    Collision-free IK:    32

[CONFIG]
  Max Pilz combinations: 16
  Max OMPL combinations: 1024
  Pilz PTP timeout:      10.00 s
  OMPL timeout:          3.00 s
  OMPL planner:          RRTConnect

[PLANNING PHASES]
  Phase 1: Pilz-PTP
    Attempts:         1 / 32
    Duration:         150.16 ms
    Result:           SUCCESS

[PLANNING RESULT]
  Status:          SUCCESS
  Success planner: Pilz-PTP
  Success attempt: 1
  Success IK idx:  [0]
  Total duration:  203.09 ms

[ATTEMPT HISTORY] (1 attempts)
  Format: #attempt [phase] IK=[indices] -> result
  ---------------------------------------------------------------
  #  1 [Pilz-PTP] IK=[0] -> SUCCESS

[EXECUTION]
  Trajectories:    1
  Duration:        2085.45 ms
  Status:          SUCCESS

[SUMMARY]
  2026-01-12T23:14:34.545 | PLAN_OK | EXEC_OK | Steps:1 | IK:32 | Pilz-PTP@1 | Plan:203.09ms | Exec:2085.45ms
================================================================================

